{
  "$schema": "https://json-schema.org/draft/2020-12/schema",
  "$id": "https://github.com/buchk/TypeFerence/conformance/schemas/claude-code/marketplace.schema.json",
  "title": "Claude Code marketplace.json as TypeFerence emits it",
  "description": "The subset of the Claude Code marketplace index that build writes to .claude-plugin/marketplace.json.",
  "type": "object",
  "additionalProperties": false,
  "required": [
    "name",
    "owner",
    "metadata",
    "plugins"
  ],
  "properties": {
    "name": {
      "type": "string",
      "minLength": 1
    },
    "owner": {
      "type": "object",
      "additionalProperties": false,
      "required": [
        "name"
      ],
      "properties": {
        "name": {
          "type": "string",
          "minLength": 1
        }
      }
    },
    "metadata": {
      "type": "object",
      "additionalProperties": false,
      "required": [
        "version"
      ],
      "properties": {
        "description": {
          "type": "string",
          "minLength": 1
        },
        "version": {
          "type": "string"
        }
      }
    },
    "plugins": {
      "type": "array",
      "items": {
        "type": "object",
        "additionalProperties": false,
        "required": [
          "name",
          "source",
          "description",
          "version"
        ],
        "properties": {
          "name": {
            "type": "string",
            "pattern": "^[a-z0-9]+(-[a-z0-9]+)*$"
          },
          "source": {
            "type": "string",
            "pattern": "^\\./claude/[a-z0-9]+(-[a-z0-9]+)*$"
          },
          "description": {
            "type": "string"
          },
          "version": {
            "type": "string"
          },
          "author": {
            "type": "object",
            "additionalProperties": false,
            "required": [
              "name"
            ],
            "properties": {
              "name": {
                "type": "string",
                "minLength": 1
              },
              "email": {
                "type": "string",
                "minLength": 1
              },
              "url": {
                "type": "string",
                "minLength": 1
              }
            }
          },
          "homepage": {
            "type": "string",
            "minLength": 1
          },
          "repository": {
            "type": "string",
            "minLength": 1
          },
          "license": {
            "type": "string",
            "minLength": 1
          },
          "keywords": {
            "type": "array",
            "minItems": 1,
            "uniqueItems": true,
            "items": {
              "type": "string",
              "minLength": 1
            }
          },
          "category": {
            "type": "string",
            "minLength": 1
          },
          "tags": {
            "type": "array",
            "minItems": 1,
            "uniqueItems": true,
            "items": {
              "type": "string",
              "minLength": 1
            }
          }
        }
      },
      "minItems": 1
    }
  }
}
